Publications,Yes,No
 Has your software contributed to research that has been published in a journal or at a conference?,89.58333333333334,10.416666666666668
" In general, when your software contributes to a paper, are you acknowledged in that paper?",70.76923076923077,29.230769230769234
 Are you generally named as the main author of the paper?,28.57142857142857,71.42857142857143
 Are you generally named as a co-author of the paper?,80.0,20.0
 Are you generally acknowledged in the main text of the paper?,53.84615384615385,46.15384615384615
