,Never,Sometimes,Often,Very Often,Always
Do you receive sufficient information on the results of your work?,3,30,42,35,28
Does your work give you the opportunity to check on how well you are doing your work?,8,39,37,30,19
"In your work, do you have access to sufficient data and information?",2,18,38,47,29
Do you receive sufficient information on the purpose of your work?,3,15,13,51,57
Does your work provide you with direct feedback on how well you are doing your work?,10,34,39,37,18
Does your supervisor/line manager inform you about how well you are doing your work?,10,49,38,20,16
Do your colleagues inform you about how well you are doing your work?,10,62,40,21,6
