Publications,Yes,No
 Has your software contributed to research that has been published in a journal or at a conference?,94.66666666666667,5.333333333333334
" In general, when your software contributes to a paper, are you acknowledged in that paper?",77.33333333333333,22.666666666666664
 Are you generally named as the main author of the paper?,32.758620689655174,67.24137931034483
 Are you generally named as a co-author of the paper?,89.74358974358975,10.256410256410255
 Are you generally acknowledged in the main text of the paper?,50.0,50.0
