,Rank 1,Rank 2,Rank 3,Rank 4,Rank 5,Rank 6,Rank 7,Rank 8
Desire to work in a research environment,28.95,20.53,20.0,15.79,7.89,3.16,2.63,1.05
Desire to advance research,20.43,20.43,22.04,11.29,12.9,8.06,4.84,
Opportunity to develop software,18.6,19.19,15.12,14.53,13.95,5.81,6.98,5.81
I want to learn new skills,15.98,16.57,13.61,18.34,13.61,11.83,6.51,3.55
Freedom to choose own working practices,14.65,12.1,17.83,14.01,13.38,11.46,12.74,3.82
Opportunity for career advancement,14.49,16.67,11.59,10.14,10.14,13.04,11.59,12.32
Ability to work across disciplines,10.27,21.23,18.49,14.38,11.64,14.38,4.11,5.48
Flexible working hours,9.4,9.4,8.72,18.12,15.44,12.75,10.74,15.44
The salary,7.89,4.39,7.89,13.16,11.4,14.04,23.68,17.54
