,Strongly disagree,Disagree,Neither agree or disagree,Agree,Strongly Agree
I am satisfied with my supervisor/line manager's confidence in me,2,12,24,63,58
I am satisfied with a word of thanks from my supervisor/line manager,13,14,40,70,22
I am satisfied with the recognition I receive from my supervisor/line manager for doing my job,12,24,34,59,30
I am satisfied with the compliments from my supervisor/line manager concerning my work,10,14,40,61,34
I am satisfied with the encouragement from my supervisor/line manager while doing my job,14,23,37,60,25
