,Rank 1,Rank 2,Rank 3,Rank 4,Rank 5
Desire to work in a research environment,36.84,21.53,17.7,12.92,11.0
Freedom to choose own working practices,32.0,23.56,18.22,13.33,12.89
Desire to advance research,30.25,23.46,15.43,19.14,11.73
I want to learn new skills,12.45,19.74,26.18,22.32,19.31
Opportunity to develop software,14.29,21.77,17.01,23.81,23.13
Flexible working hours,10.47,15.7,23.84,20.93,29.07
Opportunity for career advancement,17.0,20.0,16.0,24.0,23.0
Ability to work across disciplines,7.65,19.13,24.04,24.59,24.59
The salary,7.69,7.69,15.38,26.92,42.31
