,Rank 1,Rank 2,Rank 3,Rank 4,Rank 5
Desire to work in a research environment,38.93,22.14,15.27,12.98,10.69
Freedom to choose own working practices,32.88,23.29,19.18,10.27,14.38
Desire to advance research,27.47,21.98,21.98,18.68,9.89
I want to learn new skills,11.76,16.34,26.14,26.14,19.61
Opportunity to develop software,18.09,23.4,13.83,21.28,23.4
Opportunity for career advancement,16.42,20.9,13.43,20.9,28.36
Ability to work across disciplines,7.89,20.18,24.56,24.56,22.81
Flexible working hours,5.77,17.31,25.0,20.19,31.73
The salary,10.42,10.42,12.5,35.42,31.25
